{
  "schemaVersion": 1,
  "fixtureId": "fixture.release.alliance",
  "route": "Alliance",
  "commitBoundary": "IMMEDIATELY_BEFORE_FINAL_ROUTE_COMMIT",
  "brokerTag": "broker_alliance",
  "loyaltyAction": {
    "system": "UDACaptureComponent",
    "outcome": "Gift",
    "targetDefinition": "forgeweave.infinite_foundry",
    "recipient": "civilization.ironheart_workers",
    "giftLoyaltyReward": 60
  },
  "relationship": {"trust": 85, "respect": 85, "grievance": 0},
  "sourceAuthorities": [
    "diplomacy.trust.reason_ledger",
    "diplomacy.respect.reason_ledger",
    "diplomacy.compatibility.reason_ledger",
    "campaign.foundry_shortage.brokered_compact",
    "quest.third_foundry.completed",
    "history.joint_forgeweave_crisis_success",
    "history.forge_relic_voluntary_transfer",
    "conflict.capture.gift_loyalty"
  ],
  "daxtonOutcome": {
    "leaderState": "AlliedForgeLord",
    "saveGrandForge": true,
    "evacuateWorkers": true,
    "offerProductionUnion": true
  },
  "expectedAftermath": {
    "loyalty": "PAIRWISE_DISTINCT",
    "daxtonState": "PAIRWISE_DISTINCT",
    "historyTags": "PAIRWISE_DISTINCT",
    "damageFingerprint": "PAIRWISE_DISTINCT",
    "relationship": "PAIRWISE_DISTINCT"
  },
  "generationContract": {
    "tool": "Build/Tools/ReleaseCandidateTool.py",
    "automationTest": "Dominion.Release.VerticalSlice",
    "binaryAssetPolicy": "SOURCE_ONLY_NO_FABRICATED_UASSET"
  }
}
